<?xml version="1.0" encoding="UTF-8"?>
<Hotels xmlns:xsi="http://www.w3.org/2001/XMLSchema-instance"
        xsi:noNamespaceSchemaLocation="Hotels.xsd">

 
  <Hotel Rating="4.2">
    <Name>Westin</Name>
    <Phone>480-968-8885</Phone>
    <Phone>800-937-8461</Phone>
    <Address NearestAirport="Sky Harbor">
      <Number>11</Number>
      <Street>E 7th St</Street>
      <City>Tempe</City>
      <State>AZ</State>
      <Zip>85281</Zip>
    </Address>
  </Hotel>

  
  <Hotel Rating="4.5">
    <Name>Marriott Downtown</Name>
    <Phone>602-333-3333</Phone>
    <Address NearestAirport="Phoenix Sky Harbor">
      <Number>100</Number>
      <Street>E Adams St</Street>
      <City>Phoenix</City>
      <State>AZ</State>
      <Zip>85004</Zip>
    </Address>
  </Hotel>

  <Hotel Rating="4.0">
    <Name>Hyatt Place Tempe</Name>
    <Phone>480-967-5151</Phone>
    <Phone>800-233-1234</Phone>
    <Address>
      <Number>1413</Number>
      <Street>W Rio Salado Pkwy</Street>
      <City>Tempe</City>
      <State>AZ</State>
      <Zip>85281</Zip>
    </Address>
  </Hotel>

  <Hotel Rating="3.8">
    <Name>Hilton Garden Inn</Name>
    <Phone>480-966-7000</Phone>
    <Address NearestAirport="Phoenix Sky Harbor">
      <Number>15</Number>
      <Street>E Fifth St</Street>
      <City>Tempe</City>
      <State>AZ</State>
      <Zip>85281</Zip>
    </Address>
  </Hotel>

  <Hotel Rating="4.7">
    <Name>AC Hotel by Marriott</Name>
    <Phone>480-642-6140</Phone>
    <Address>
      <Number>51</Number>
      <Street>E 5th St</Street>
      <City>Tempe</City>
      <State>AZ</State>
      <Zip>85281</Zip>
    </Address>
  </Hotel>

  <Hotel Rating="3.9">
    <Name>Hampton Inn &amp; Suites</Name>
    <Phone>480-410-6100</Phone>
    <Address NearestAirport="Mesa Gateway Airport">
      <Number>1550</Number>
      <Street>S 52nd St</Street>
      <City>Tempe</City>
      <State>AZ</State>
      <Zip>85281</Zip>
    </Address>
  </Hotel>

  <Hotel Rating="4.6">
    <Name>Canopy by Hilton</Name>
    <Phone>480-568-3615</Phone>
    <Address>
      <Number>108</Number>
      <Street>E University Dr</Street>
      <City>Tempe</City>
      <State>AZ</State>
      <Zip>85281</Zip>
    </Address>
  </Hotel>

  <Hotel Rating="4.3">
    <Name>Courtyard by Marriott</Name>
    <Phone>480-966-2800</Phone>
    <Address NearestAirport="Phoenix Sky Harbor">
      <Number>601</Number>
      <Street>S Ash Ave</Street>
      <City>Tempe</City>
      <State>AZ</State>
      <Zip>85281</Zip>
    </Address>
  </Hotel>

  <Hotel Rating="3.7">
    <Name>Holiday Inn Express</Name>
    <Phone>480-727-4771</Phone>
    <Phone>480-727-4772</Phone>
    <Address>
      <Number>670</Number>
      <Street>E Apache Blvd</Street>
      <City>Tempe</City>
      <State>AZ</State>
      <Zip>85281</Zip>
    </Address>
  </Hotel>

  <Hotel Rating="4.4">
    <Name>Graduate Tempe</Name>
    <Phone>480-967-9431</Phone>
    <Address NearestAirport="Sky Harbor">
      <Number>225</Number>
      <Street>E Apache Blvd</Street>
      <City>Tempe</City>
      <State>AZ</State>
      <Zip>85281</Zip>
    </Address>
  </Hotel>

  <!-- 11th -->
  <Hotel Rating="4.1">
    <Name>Moxy Phoenix Tempe/ASU Area</Name>
    <Phone>480-968-3451</Phone>
    <Address>
      <Number>1333</Number>
      <Street>S Rural Rd</Street>
      <City>Tempe</City>
      <State>AZ</State>
      <Zip>85281</Zip>
    </Address>
  </Hotel>

</Hotels>
